CREATE DATABASE Human_Resource;

Query OK, 1 row affected (0.01 sec)

USE Human_Resource;

Database changed




------------------------------------------------------------------------------------------------------------------------

CREATE TABLE Location(
    Location_ID INT PRIMARY KEY,
    City VARCHAR(50) NOT NULL DEFAULT 'Vavuniya'
);
Query OK, 0 rows affected (0.01 sec)




CREATE TABLE Job_Details(
    Job_ID VARCHAR(20) PRIMARY KEY,
    Job_Title VARCHAR(100) NOT NULL,
    Min_Salary DECIMAL(10,2) DEFAULT 5000 CHECK (Min_Salary > 0),
    Max_Salary DECIMAL(10,2) DEFAULT 100000 CHECK (Max_Salary > 0)
);
Query OK, 0 rows affected (0.02 sec)




CREATE TABLE Department(
    Department_Id INT PRIMARY KEY,
    Department_Name VARCHAR(100) NOT NULL DEFAULT 'HR',
    Manager_Id INT NOT NULL,
    Location_Id INT NOT NULL,
    FOREIGN KEY (Location_Id) REFERENCES Location(Location_ID)
);
Query OK, 0 rows affected (0.01 sec)


CREATE TABLE Employee(
    Employee_Id INT PRIMARY KEY,
    First_Name VARCHAR(50) NOT NULL,
    Last_Name VARCHAR(50) NOT NULL,
    Email VARCHAR(100) NOT NULL,
    Hire_Date DATE,
    Salary DECIMAL(10,2) CHECK (Salary > 0),
    Job_Id VARCHAR(20),
    Department_Id INT,
    FOREIGN KEY (Job_Id) REFERENCES Job_Details(Job_ID),
    FOREIGN KEY (Department_Id) REFERENCES Department(Department_Id)
);
Query OK, 0 rows affected (0.01 sec)




-------------------------------------------------------------------------------------------------------------------

INSERT INTO Location VALUES (1000, 'Colombo');
INSERT INTO Location VALUES (1100, 'Vavuniya');
INSERT INTO Location VALUES (1200, 'Anuradhapura');
INSERT INTO Location VALUES (1300, 'Kandy');
INSERT INTO Location VALUES (1400, 'Jaffna');




INSERT INTO Job_Details VALUES ('AD_PRES','President',20000.0,40000.0);
INSERT INTO Job_Details VALUES ('AD_VP','Administration Vice President',15000.0,30000.0);
INSERT INTO Job_Details VALUES ('AD_ASST','Administration Assistant',3000.0,6000.0);
INSERT INTO Job_Details VALUES ('FI_MGR','Finance Manager',8200.0,16000.0);
INSERT INTO Job_Details VALUES ('FI_ACCOUNT','Accountant',4200.0,9000.0);
INSERT INTO Job_Details VALUES ('AC_MGR','Accounting Manager',8200.0,16000.0);
INSERT INTO Job_Details VALUES ('AC_ACCOUNT','Public Accountant',4200.0,9000.0);
INSERT INTO Job_Details VALUES ('SA_MAN','Sales Manager',10000.0,20000.0);
INSERT INTO Job_Details VALUES ('SA_REP','Sales Representative',6000.0,12000.0);
INSERT INTO Job_Details VALUES ('PU_MAN','Purchasing Manager',8000.0,15000.0);
INSERT INTO Job_Details VALUES ('PU_CLERK','Purchasing Clerk',2500.0,5500.0);
INSERT INTO Job_Details VALUES ('ST_MAN','Stock Manager',5500.0,8500.0);
INSERT INTO Job_Details VALUES ('ST_CLERK','Stock Clerk',2000.0,5000.0);
INSERT INTO Job_Details VALUES ('SH_CLERK','Shipping Clerk',2500.0,5500.0);
INSERT INTO Job_Details VALUES ('IT_PROG','Programmer',4000.0,10000.0);
INSERT INTO Job_Details VALUES ('MK_MAN','Marketing Manager',9000.0,15000.0);
INSERT INTO Job_Details VALUES ('MK_REP','Marketing Representative',4000.0,9000.0);
INSERT INTO Job_Details VALUES ('HR_REP','Human Resources Representative',4000.0,9000.0);
INSERT INTO Job_Details VALUES ('PR_REP','Public Relations Representative',4500.0,10500.0);





INSERT INTO Department VALUES (10,'Administration',110,1000);
INSERT INTO Department VALUES (20,'Marketing',108,1100);
INSERT INTO Department VALUES (30,'Purchasing',114,1100);
INSERT INTO Department VALUES (40,'Human Resources',103,1000);
INSERT INTO Department VALUES (50,'Shipping',121,1000);
INSERT INTO Department VALUES (60,'IT',106,1400);
INSERT INTO Department VALUES (70,'Public Relations',125,1300);
INSERT INTO Department VALUES (80,'Sales',115,1200);
INSERT INTO Department VALUES (90,'Executive',100,1300);
INSERT INTO Department VALUES (100,'Finance',117,1000);
INSERT INTO Department VALUES (110,'Accounting',120,1000);





INSERT INTO Employee VALUES (100,'Steven','Rajan','srajan@gmail.com','2003-06-17',6000.00,'AD_ASST',90);
INSERT INTO Employee VALUES (101,'Neena','Mathan','nmathan@gmail.com',NULL,17000.00,'SA_REP',80);
INSERT INTO Employee VALUES (102,'Luxi','Kaanthan','lkanthan@gmail.com','2001-01-13',17000.00,'MK_REP',20);
INSERT INTO Employee VALUES (103,'Alex','Ronald','aronald@gmail.com','2006-01-03',9000.00,'HR_REP',40);
INSERT INTO Employee VALUES (104,'Bavan','Kathirvel','bkathirvel@gmail.com',NULL,6000.00,'PR_REP',70);
INSERT INTO Employee VALUES (105,'David','Austin','daustin@gmail.com','2005-06-25',4800.00,'FI_ACCOUNT',100);
INSERT INTO Employee VALUES (106,'Valli','Bala','vbala@gmail.com','2006-02-05',4800.00,'IT_PROG',60);
INSERT INTO Employee VALUES (107,'Diana','Lawrence','dlawrence@gmail.com',NULL,4200.00,'AC_ACCOUNT',110);
INSERT INTO Employee VALUES (108,'Nancy','Desman','ndesman@gmail.com','2002-08-17',12000.00,'MK_MAN',20);
INSERT INTO Employee VALUES (109,'Daniel','Faviet','dfaviet@gmail.com','2002-08-16',9000.00,'FI_ACCOUNT',100);
INSERT INTO Employee VALUES (110,'John','Shekaan','jshekaan@gmail.com','2005-09-28',30000.00,'AD_PRES',10);
INSERT INTO Employee VALUES (111,'Ismael','Mohamed','imohamed@gmail.com','2005-09-30',6000.00,'AD_ASST',90);
INSERT INTO Employee VALUES (112,'Jose','Urman','jurman@gmail.com','2006-03-07',7800.00,'HR_REP',40);
INSERT INTO Employee VALUES (113,'Kamal','Maniyam','kmaniyam@gmail.com','2007-12-07',6900.00,'IT_PROG',60);
INSERT INTO Employee VALUES (114,'Gihan','Perera','gperera@gmail.com','2002-12-07',11000.00,'PU_MAN',30);
INSERT INTO Employee VALUES (115,'Akilan','Thaas','athass@gmail.com','2003-05-18',15000.00,'SA_MAN',80);
INSERT INTO Employee VALUES (116,'Shelli','Baida','sbaida@gmail.com','2005-12-24',3000.00,'PU_CLERK',30);
INSERT INTO Employee VALUES (117,'Swetha','Mohan','smohan@gmail.com','2005-07-24',9000.00,'FI_MGR',100);
INSERT INTO Employee VALUES (118,'Gowri','Balan','gbalan@gmail.com','2006-11-15',6000.00,'AD_ASST',10);
INSERT INTO Employee VALUES (119,'Karan','Kathir','kkathir@gmail.com','2007-08-10',4000.00,'MK_REP',20);
INSERT INTO Employee VALUES (120,'Bandara','Kumara','bkumara@gmail.com','2004-07-18',10000.00,'AC_MGR',110);
INSERT INTO Employee VALUES (121,'Adam','Fripp','afripp@gmail.com','2005-04-10',5000.00,'SH_CLERK',50);
INSERT INTO Employee VALUES (122,'Pathma','Maaran','pmaaran@gmail.com','2003-05-01',7900.00,'SA_REP',80);
INSERT INTO Employee VALUES (123,'Shanth','Velu','svelu@gmail.com','2005-10-10',6500.00,'AC_ACCOUNT',110);
INSERT INTO Employee VALUES (124,'Kevin','Mathu','kmathu@gmail.com','2007-11-16',5000.00,'SH_CLERK',50);
INSERT INTO Employee VALUES (125,'Julia','Nayer','jnayar@gmail.com','2005-07-16',4500.00,'PR_REP',70);






------------------------------------------------------------------------------------------------------------------------


mysql> select * from Location;
+-------------+--------------+
| Location_ID | City         |
+-------------+--------------+
|        1000 | Colombo      |
|        1100 | Vavuniya     |
|        1200 | Anuradhapura |
|        1300 | Kandy        |
|        1400 | Jaffna       |
+-------------+--------------+
5 rows in set (0.00 sec)



mysql> select * from Job_Details;
+------------+---------------------------------+------------+------------+
| Job_ID     | Job_Title                       | Min_Salary | Max_Salary |
+------------+---------------------------------+------------+------------+
| AC_ACCOUNT | Public Accountant               |    4200.00 |    9000.00 |
| AC_MGR     | Accounting Manager              |    8200.00 |   16000.00 |
| AD_ASST    | Administration Assistant        |    3000.00 |    6000.00 |
| AD_PRES    | President                       |   20000.00 |   40000.00 |
| AD_VP      | Administration Vice President   |   15000.00 |   30000.00 |
| FI_ACCOUNT | Accountant                      |    4200.00 |    9000.00 |
| FI_MGR     | Finance Manager                 |    8200.00 |   16000.00 |
| HR_REP     | Human Resources Representative  |    4000.00 |    9000.00 |
| IT_PROG    | Programmer                      |    4000.00 |   10000.00 |
| MK_MAN     | Marketing Manager               |    9000.00 |   15000.00 |
| MK_REP     | Marketing Representative        |    4000.00 |    9000.00 |
| PR_REP     | Public Relations Representative |    4500.00 |   10500.00 |
| PU_CLERK   | Purchasing Clerk                |    2500.00 |    5500.00 |
| PU_MAN     | Purchasing Manager              |    8000.00 |   15000.00 |
| SA_MAN     | Sales Manager                   |   10000.00 |   20000.00 |
| SA_REP     | Sales Representative            |    6000.00 |   12000.00 |
| SH_CLERK   | Shipping Clerk                  |    2500.00 |    5500.00 |
| ST_CLERK   | Stock Clerk                     |    2000.00 |    5000.00 |
| ST_MAN     | Stock Manager                   |    5500.00 |    8500.00 |
+------------+---------------------------------+------------+------------+
19 rows in set (0.00 sec)




mysql> select * from Department;
+---------------+------------------+------------+-------------+
| Department_Id | Department_Name  | Manager_Id | Location_Id |
+---------------+------------------+------------+-------------+
|            10 | Administration   |        110 |        1000 |
|            20 | Marketing        |        108 |        1100 |
|            30 | Purchasing       |        114 |        1100 |
|            40 | Human Resources  |        103 |        1000 |
|            50 | Shipping         |        121 |        1000 |
|            60 | IT               |        106 |        1400 |
|            70 | Public Relations |        125 |        1300 |
|            80 | Sales            |        115 |        1200 |
|            90 | Executive        |        100 |        1300 |
|           100 | Finance          |        117 |        1000 |
|           110 | Accounting       |        120 |        1000 |
+---------------+------------------+------------+-------------+
11 rows in set (0.00 sec)




mysql> select * from Employee;
+-------------+------------+-----------+----------------------+------------+----------+------------+---------------+
| Employee_Id | First_Name | Last_Name | Email                | Hire_Date  | Salary   | Job_Id     | Department_Id |
+-------------+------------+-----------+----------------------+------------+----------+------------+---------------+
|         100 | Steven     | Rajan     | srajan@gmail.com     | 2003-06-17 |  6000.00 | AD_ASST    |            90 |
|         101 | Neena      | Mathan    | nmathan@gmail.com    | NULL       | 17000.00 | SA_REP     |            80 |
|         102 | Luxi       | Kaanthan  | lkanthan@gmail.com   | 2001-01-13 | 17000.00 | MK_REP     |            20 |
|         103 | Alex       | Ronald    | aronald@gmail.com    | 2006-01-03 |  9000.00 | HR_REP     |            40 |
|         104 | Bavan      | Kathirvel | bkathirvel@gmail.com | NULL       |  6000.00 | PR_REP     |            70 |
|         105 | David      | Austin    | daustin@gmail.com    | 2005-06-25 |  4800.00 | FI_ACCOUNT |           100 |
|         106 | Valli      | Bala      | vbala@gmail.com      | 2006-02-05 |  4800.00 | IT_PROG    |            60 |
|         107 | Diana      | Lawrence  | dlawrence@gmail.com  | NULL       |  4200.00 | AC_ACCOUNT |           110 |
|         108 | Nancy      | Desman    | ndesman@gmail.com    | 2002-08-17 | 12000.00 | MK_MAN     |            20 |
|         109 | Daniel     | Faviet    | dfaviet@gmail.com    | 2002-08-16 |  9000.00 | FI_ACCOUNT |           100 |
|         110 | John       | Shekaan   | jshekaan@gmail.com   | 2005-09-28 | 30000.00 | AD_PRES    |            10 |
|         111 | Ismael     | Mohamed   | imohamed@gmail.com   | 2005-09-30 |  6000.00 | AD_ASST    |            90 |
|         112 | Jose       | Urman     | jurman@gmail.com     | 2006-03-07 |  7800.00 | HR_REP     |            40 |
|         113 | Kamal      | Maniyam   | kmaniyam@gmail.com   | 2007-12-07 |  6900.00 | IT_PROG    |            60 |
|         114 | Gihan      | Perera    | gperera@gmail.com    | 2002-12-07 | 11000.00 | PU_MAN     |            30 |
|         115 | Akilan     | Thaas     | athass@gmail.com     | 2003-05-18 | 15000.00 | SA_MAN     |            80 |
|         116 | Shelli     | Baida     | sbaida@gmail.com     | 2005-12-24 |  3000.00 | PU_CLERK   |            30 |
|         117 | Swetha     | Mohan     | smohan@gmail.com     | 2005-07-24 |  9000.00 | FI_MGR     |           100 |
|         118 | Gowri      | Balan     | gbalan@gmail.com     | 2006-11-15 |  6000.00 | AD_ASST    |            10 |
|         119 | Karan      | Kathir    | kkathir@gmail.com    | 2007-08-10 |  4000.00 | MK_REP     |            20 |
|         120 | Bandara    | Kumara    | bkumara@gmail.com    | 2004-07-18 | 10000.00 | AC_MGR     |           110 |
|         121 | Adam       | Fripp     | afripp@gmail.com     | 2005-04-10 |  5000.00 | SH_CLERK   |            50 |
|         122 | Pathma     | Maaran    | pmaaran@gmail.com    | 2003-05-01 |  7900.00 | SA_REP     |            80 |
|         123 | Shanth     | Velu      | svelu@gmail.com      | 2005-10-10 |  6500.00 | AC_ACCOUNT |           110 |
|         124 | Kevin      | Mathu     | kmathu@gmail.com     | 2007-11-16 |  5000.00 | SH_CLERK   |            50 |
|         125 | Julia      | Nayer     | jnayar@gmail.com     | 2005-07-16 |  4500.00 | PR_REP     |            70 |
+-------------+------------+-----------+----------------------+------------+----------+------------+---------------+
26 rows in set (0.00 sec)




--------------------------------------------------------------------------------------------------------------------------------------------

i. Replace all the null values on the Hire_date field of the employee table with 2008-03-17 using IFNULL function.
 
 
SELECT Employee_Id, First_Name, Last_Name,
IFNULL(Hire_Date,'2008-03-17') AS Hire_Date
FROM Employee;


UPDATE Employee
SET Hire_Date = IFNULL(Hire_Date,'2008-03-17');

+-------------+------------+-----------+------------+
| Employee_Id | First_Name | Last_Name | Hire_Date  |
+-------------+------------+-----------+------------+
|         100 | Steven     | Rajan     | 2003-06-17 |
|         101 | Neena      | Mathan    | 2008-03-17 |
|         102 | Luxi       | Kaanthan  | 2001-01-13 |
|         103 | Alex       | Ronald    | 2006-01-03 |
|         104 | Bavan      | Kathirvel | 2008-03-17 |
|         105 | David      | Austin    | 2005-06-25 |
|         106 | Valli      | Bala      | 2006-02-05 |
|         107 | Diana      | Lawrence  | 2008-03-17 |
|         108 | Nancy      | Desman    | 2002-08-17 |
|         109 | Daniel     | Faviet    | 2002-08-16 |
|         110 | John       | Shekaan   | 2005-09-28 |
|         111 | Ismael     | Mohamed   | 2005-09-30 |
|         112 | Jose       | Urman     | 2006-03-07 |
|         113 | Kamal      | Maniyam   | 2007-12-07 |
|         114 | Gihan      | Perera    | 2002-12-07 |
|         115 | Akilan     | Thaas     | 2003-05-18 |
|         116 | Shelli     | Baida     | 2005-12-24 |
|         117 | Swetha     | Mohan     | 2005-07-24 |
|         118 | Gowri      | Balan     | 2006-11-15 |
|         119 | Karan      | Kathir    | 2007-08-10 |
|         120 | Bandara    | Kumara    | 2004-07-18 |
|         121 | Adam       | Fripp     | 2005-04-10 |
|         122 | Pathma     | Maaran    | 2003-05-01 |
|         123 | Shanth     | Velu      | 2005-10-10 |
|         124 | Kevin      | Mathu     | 2007-11-16 |
|         125 | Julia      | Nayer     | 2005-07-16 |
+-------------+------------+-----------+------------+
26 rows in set (0.00 sec)



-------------------------------------------------------------------------------



ii. Check whether anyone has the same First_name and Last_name  in the employee relation. 


SELECT First_Name, Last_Name, COUNT(*)
FROM Employee
GROUP BY First_Name, Last_Name
HAVING COUNT(*) > 1;


mysql> SELECT First_Name, Last_Name, COUNT(*)
    -> FROM Employee
    -> GROUP BY First_Name, Last_Name
    -> HAVING COUNT(*) > 1;
Empty set (0.01 sec)



----------------------------------------------------------------------------------



iii. Check whether any job has the same max_salary and min_salary values in the Job_Details relation. 


SELECT Job_ID, Job_Title
FROM Job_Details
WHERE Min_Salary = Max_Salary;



mysql> SELECT Job_ID, Job_Title
    -> FROM Job_Details
    -> WHERE Min_Salary = Max_Salary;
Empty set (0.00 sec)




------------------------------------------------------------------------------------------------


iv. Insert a record into the Job_Details table by passing the default values for minimum and maximum salary.

INSERT INTO Job_Details (Job_ID, Job_Title)
VALUES ('NEW_JOB', 'System Analyst');

Query OK, 1 row affected (0.01 sec)



mysql> select * from Job_Details;
+------------+---------------------------------+------------+------------+
| Job_ID     | Job_Title                       | Min_Salary | Max_Salary |
+------------+---------------------------------+------------+------------+
| AC_ACCOUNT | Public Accountant               |    4200.00 |    9000.00 |
| AC_MGR     | Accounting Manager              |    8200.00 |   16000.00 |
| AD_ASST    | Administration Assistant        |    3000.00 |    6000.00 |
| AD_PRES    | President                       |   20000.00 |   40000.00 |
| AD_VP      | Administration Vice President   |   15000.00 |   30000.00 |
| FI_ACCOUNT | Accountant                      |    4200.00 |    9000.00 |
| FI_MGR     | Finance Manager                 |    8200.00 |   16000.00 |
| HR_REP     | Human Resources Representative  |    4000.00 |    9000.00 |
| IT_PROG    | Programmer                      |    4000.00 |   10000.00 |
| MK_MAN     | Marketing Manager               |    9000.00 |   15000.00 |
| MK_REP     | Marketing Representative        |    4000.00 |    9000.00 |
| NEW_JOB    | System Analyst                  |    5000.00 |  100000.00 |
| PR_REP     | Public Relations Representative |    4500.00 |   10500.00 |
| PU_CLERK   | Purchasing Clerk                |    2500.00 |    5500.00 |
| PU_MAN     | Purchasing Manager              |    8000.00 |   15000.00 |
| SA_MAN     | Sales Manager                   |   10000.00 |   20000.00 |
| SA_REP     | Sales Representative            |    6000.00 |   12000.00 |
| SH_CLERK   | Shipping Clerk                  |    2500.00 |    5500.00 |
| ST_CLERK   | Stock Clerk                     |    2000.00 |    5000.00 |
| ST_MAN     | Stock Manager                   |    5500.00 |    8500.00 |
+------------+---------------------------------+------------+------------+
20 rows in set (0.00 sec)





------------------------------------------------------------------------------------------------------------------------------------------


Write MySQL statements to prepare the index for each of the following:  

i. Create index for the employee relation on the attributes First_name and Last_name. 


CREATE INDEX idx_emp_name
ON Employee (First_Name, Last_Name);


Query OK, 0 rows affected (0.04 sec)
Records: 0  Duplicates: 0  Warnings: 0



mysql> show index from  Employee;
+----------+------------+---------------+--------------+---------------+-----------+-------------+----------+--------+------+------------+---------+---------------+---------+------------+
| Table    | Non_unique | Key_name      | Seq_in_index | Column_name   | Collation | Cardinality | Sub_part | Packed | Null | Index_type | Comment | Index_comment | Visible | Expression |
+----------+------------+---------------+--------------+---------------+-----------+-------------+----------+--------+------+------------+---------+---------------+---------+------------+
| employee |          0 | PRIMARY       |            1 | Employee_Id   | A         |          26 |     NULL |   NULL |      | BTREE      |         |               | YES     | NULL       |
| employee |          1 | Job_Id        |            1 | Job_Id        | A         |          16 |     NULL |   NULL | YES  | BTREE      |         |               | YES     | NULL       |
| employee |          1 | Department_Id |            1 | Department_Id | A         |          11 |     NULL |   NULL | YES  | BTREE      |         |               | YES     | NULL       |
| employee |          1 | idx_emp_name  |            1 | First_Name    | A         |          26 |     NULL |   NULL |      | BTREE      |         |               | YES     | NULL       |
| employee |          1 | idx_emp_name  |            2 | Last_Name     | A         |          26 |     NULL |   NULL |      | BTREE      |         |               | YES     | NULL       |
+----------+------------+---------------+--------------+---------------+-----------+-------------+----------+--------+------+------------+---------+---------------+---------+------------+
5 rows in set (0.02 sec)





mysql> SHOW INDEX FROM Employee WHERE Key_name = 'idx_emp_name';
+----------+------------+--------------+--------------+-------------+-----------+-------------+----------+--------+------+------------+---------+---------------+---------+------------+
| Table    | Non_unique | Key_name     | Seq_in_index | Column_name | Collation | Cardinality | Sub_part | Packed | Null | Index_type | Comment | Index_comment | Visible | Expression |
+----------+------------+--------------+--------------+-------------+-----------+-------------+----------+--------+------+------------+---------+---------------+---------+------------+
| employee |          1 | idx_emp_name |            1 | First_Name  | A         |          26 |     NULL |   NULL |      | BTREE      |         |               | YES     | NULL       |
| employee |          1 | idx_emp_name |            2 | Last_Name   | A         |          26 |     NULL |   NULL |      | BTREE      |         |               | YES     | NULL       |
+----------+------------+--------------+--------------+-------------+-----------+-------------+----------+--------+------+------------+---------+---------------+---------+------------+
2 rows in set (0.00 sec)





-------------------------------------------------------------------------------------------------------------------------------------------------


ii. Create index on the attributes Department_Id for the Employee relation. 


CREATE INDEX idx_emp_dept
ON Employee (Department_Id);

Query OK, 0 rows affected (0.04 sec)
Records: 0  Duplicates: 0  Warnings: 0



mysql> SHOW INDEX FROM Employee WHERE Key_name = 'idx_emp_dept';
+----------+------------+--------------+--------------+---------------+-----------+-------------+----------+--------+------+------------+---------+---------------+---------+------------+
| Table    | Non_unique | Key_name     | Seq_in_index | Column_name   | Collation | Cardinality | Sub_part | Packed | Null | Index_type | Comment | Index_comment | Visible | Expression |
+----------+------------+--------------+--------------+---------------+-----------+-------------+----------+--------+------+------------+---------+---------------+---------+------------+
| employee |          1 | idx_emp_dept |            1 | Department_Id | A         |          11 |     NULL |   NULL | YES  | BTREE      |         |               | YES     | NULL       |
+----------+------------+--------------+--------------+---------------+-----------+-------------+----------+--------+------+------------+---------+---------------+---------+------------+
1 row in set (0.01 sec)




-----------------------------------------------------------------------------------------------------------------------------------------------


iii. Create a composite index on the attributes Job_title and Max_salary for the Job_Details relation. 


CREATE INDEX idx_job_title_salary
ON Job_Details (Job_Title, Max_Salary);

Query OK, 0 rows affected (0.04 sec)
Records: 0  Duplicates: 0  Warnings: 0


mysql> SHOW INDEX FROM Job_Details WHERE Key_name = 'idx_job_title_salary';
+-------------+------------+----------------------+--------------+-------------+-----------+-------------+----------+--------+------+------------+---------+---------------+---------+------------+
| Table       | Non_unique | Key_name             | Seq_in_index | Column_name | Collation | Cardinality | Sub_part | Packed | Null | Index_type | Comment | Index_comment | Visible | Expression |
+-------------+------------+----------------------+--------------+-------------+-----------+-------------+----------+--------+------+------------+---------+---------------+---------+------------+
| job_details |          1 | idx_job_title_salary |            1 | Job_Title   | A         |          20 |     NULL |   NULL |      | BTREE      |         |               | YES     | NULL       |
| job_details |          1 | idx_job_title_salary |            2 | Max_Salary  | A         |          20 |     NULL |   NULL | YES  | BTREE      |         |               | YES     | NULL       |
+-------------+------------+----------------------+--------------+-------------+-----------+-------------+----------+--------+------+------------+---------+---------------+---------+------------+
2 rows in set (0.01 sec)




------------------------------------------------------------------------------------------------------------------------------



iv. Create a composite index on the attributes First_name and Email for the Employee relation. 


CREATE INDEX idx_emp_fname_email
ON Employee (First_Name, Email);

Query OK, 0 rows affected (0.03 sec)
Records: 0  Duplicates: 0  Warnings: 0


mysql> SHOW INDEX FROM Employee WHERE Key_name = 'idx_emp_fname_email';
+----------+------------+---------------------+--------------+-------------+-----------+-------------+----------+--------+------+------------+---------+---------------+---------+------------+
| Table    | Non_unique | Key_name            | Seq_in_index | Column_name | Collation | Cardinality | Sub_part | Packed | Null | Index_type | Comment | Index_comment | Visible | Expression |
+----------+------------+---------------------+--------------+-------------+-----------+-------------+----------+--------+------+------------+---------+---------------+---------+------------+
| employee |          1 | idx_emp_fname_email |            1 | First_Name  | A         |          26 |     NULL |   NULL |      | BTREE      |         |               | YES     | NULL       |
| employee |          1 | idx_emp_fname_email |            2 | Email       | A         |          26 |     NULL |   NULL |      | BTREE      |         |               | YES     | NULL       |
+----------+------------+---------------------+--------------+-------------+-----------+-------------+----------+--------+------+------------+---------+---------------+---------+------------+
2 rows in set (0.00 sec)




--------------------------------------------------------------------------------------------------------------------

v. List down the relational_schema, relation_name, index_name, and column_name of created indexes for the database Human_Resource.


SELECT
TABLE_SCHEMA AS relational_schema,
TABLE_NAME AS relation_name,
INDEX_NAME AS index_name,
COLUMN_NAME AS column_name
FROM INFORMATION_SCHEMA.STATISTICS
WHERE TABLE_SCHEMA = 'Human_Resource';



+-------------------+---------------+----------------------+---------------+
| relational_schema | relation_name | index_name           | column_name   |
+-------------------+---------------+----------------------+---------------+
| human_resource    | location      | PRIMARY              | Location_ID   |
| human_resource    | department    | PRIMARY              | Department_Id |
| human_resource    | department    | Location_Id          | Location_Id   |
| human_resource    | job_details   | PRIMARY              | Job_ID        |
| human_resource    | job_details   | idx_job_title_salary | Job_Title     |
| human_resource    | job_details   | idx_job_title_salary | Max_Salary    |
| human_resource    | employee      | PRIMARY              | Employee_Id   |
| human_resource    | employee      | Job_Id               | Job_Id        |
| human_resource    | employee      | idx_emp_name         | First_Name    |
| human_resource    | employee      | idx_emp_name         | Last_Name     |
| human_resource    | employee      | idx_emp_dept         | Department_Id |
| human_resource    | employee      | idx_emp_fname_email  | First_Name    |
| human_resource    | employee      | idx_emp_fname_email  | Email         |
+-------------------+---------------+----------------------+---------------+
13 rows in set (0.01 sec)
